{
  "item_type": "ncert_book",
  "subject": "Biology",
  "class": 11,
  "edition": "latest",
  "year": null,
  "sitting": null,
  "booklet_code": null,
  "file": null,
  "in_scope": null,
  "status": "present",
  "note": "19 latest-edition chapter PDF(s) found (one-PDF-per-chapter layout; treated as one logical book per docs/OPEN_QUESTIONS.md 2026-10-09 Section 9 A1/A2 entry)"
}
